,,,,,,,,,,,,,,,,,,,,,
,GUIDELINES,,,,,,,,,,,,,,,,,,,,
,ID,Guideline,,,,,,,,,,,,,,,,,,,
,1,All options should be grammatically consistent with the stem and should be parallel in style and form. Non-grammatically correct options provide cues to the students who easily eliminate distracters that do not flow grammatically with the stem.,,,,,,,,,,,,,,,,,,,
,2,Each MCQ should have a clear and focused question. Teachers should avoid using MCQs with unfocused stems which do not ask a clear question or state a clear problem in the sentence completion format.,,,,,,,,,,,,,,,,,,,
,3,"Each MCQ should have the problem in the stem of the question, not in the options. The options should not be a series of true/false statements.",,,,,,,,,,,,,,,,,,,
,4,"The basic format for MCQs is the single best answer. Therefore, ensure that questions have one, and only one, best answer.",,,,,,,,,,,,,,,,,,,
,5,"Avoid gratuitous or unnecessary information in the stem or the options. If a vignette is provided with the MCQ, it should be required to answer the question.",,,,,,,,,,,,,,,,,,,
,6,"Avoid complex, or K-type MCQs. K-type MCQs have a range of correct responses and then ask students to select from a number of possible combinations of these responses. Students can often guess the answer by eliminating one incorrect response and all options containing this response or by selecting the responses which appear most frequently in all of the options.",,,,,,,,,,,,,,,,,,,
,7,"Questions and all options should be written in clear, unambiguous language. Poorly worded or ambiguous questions can confuse even knowledgeable students and cause them to answer incorrectly.",,,,,,,,,,,,,,,,,,,
,8,Make all distracters plausible as plausible distracters are vital to high quality MCQs. Students who do not know the material increase their chances of guessing the correct option by eliminating implausible distracters.,,,,,,,,,,,,,,,,,,,
,9,Avoid repeating words in the stem and the correct option. Similar wording allows students to identify the correct option without knowing the material.,,,,,,,,,,,,,,,,,,,
,10,Avoid providing logical cues in the stem and the correct option that can help the student to identify the correct option without knowing the material. An example of a logical cue is asking students to select the most appropriate pharmaceutical intervention for a problem and only having one or two options which are actually pharmaceutical interventions.,,,,,,,,,,,,,,,,,,,
,11,Avoid convergence cues in options where there are different combinations of multiple components to the answer. Question writers tend to use the correct answers more frequently across all options and students will identify as correct the answer in which all components appear most frequently.,,,,,,,,,,,,,,,,,,,
,12,"All options should be similar in length and amount of detail provided in the option. If one option is longer, includes more detailed information, or it contains more complex language, students can usually correctly assume that this is the correct answer.",,,,,,,,,,,,,,,,,,,
,13,"Arrange MCQ options in alphabetical, chronological, or numerical order. (We assess for chronological and numerical, but not alphabetical order).",,,,,,,,,,,,,,,,,,,
,14,"Options should be worded to avoid the use of absolute terms (e.g., never, always, only, all) as students are taught that there are often no absolute truths in most health science subjects and they can therefore eliminate these distracters.",,,,,,,,,,,,,,,,,,,
,15,"Options should be worded to avoid the use of vague terms (e.g., frequently, occasionally, rarely, usually, commonly) as these terms lack precision and there is seldom agreement on the actual meaning of ‘‘often’’ or ‘‘frequently’’.",,,,,,,,,,,,,,,,,,,
,16,"Avoid the use of negatives (e.g., not, except, incorrect) in the stem as they poorly assess students actual knowledge. If teachers wish to assess contraindications, the questions should be worded clearly to indicate that this is what is being assessed.",,,,,,,,,,,,,,,,,,,
,17,"Avoid the use of ‘‘all of the above’’ as the last option. Students can easily identify if this is the correct answer by simply knowing that at least two of the options are correct. Similarly, they can eliminate it by knowing if only one of the options is incorrect.",,,,,,,,,,,,,,,,,,,
,18,"Avoid the use of ‘‘none of the above’’ as the last option as it only measures students’ ability to detect incorrect answers. Furthermore, if ‘‘none of the above’’ is the correct option, the teacher must be certain that there are no exceptions to any of the options that the student may detect.",,,,,,,,,,,,,,,,,,,
,19,Avoid fill-in-the-blank format whereby a word is omitted in the middle of a sentence and the student must guess the correct word. All options should be placed at the end of the stem.,,,,,,,,,,,,,,,,,,,
,,,,,,,,,,,,,,,,,,,,,
,RESULTS A,,,,,,,,,,,,,,,,,,,,
,ID,Original Question,Generated Question,Correct Answer,Distractor 1,Distractor 2,Distractor 3,Generated Distractors,Context,,,,,,,,,,,,
,0,"What instrument is used to make very sensitive mass measurements in a laboratory, usually in grams?","What type of balance makes very sensitive mass measurements in a laboratory, usually in grams?",analytical balance,speedometer,thermometer,scale,"['weighing balance', 'weighing scale', 'weighing scale']","An analytical balance makes very sensitive mass measurements in a laboratory, usually in grams.",,,,,,,,,,,,
,1,What is a thin membrane stretched tight across the end of the ear canal that vibrates when sound waves strike it?,What is the head of a drum called?,eardrum,earlobe,cerebrum,auricle,"['ear canal', 'middle ear', 'head of the drum']","The eardrum is like the head of a drum. It’s a thin membrane stretched tight across the end of the ear canal. The eardrum vibrates when sound waves strike it, and it sends the vibrations on to the middle ear.",,,,,,,,,,,,
,2,"Like the frame of a house, what gives the cell an internal structure?","What gives the cell an internal structure, like the frame of a house?",cytoskeleton,cytoplasm,cellulose,endoskeleton,"['filaments', 'cell nuclei', 'tubules']","Cytoskeleton. The cytoskeleton gives the cell an internal structure, like the frame of a house. In this photograph, filaments and tubules of the cytoskeleton are green and red, respectively. The blue dots are cell nuclei.",,,,,,,,,,,,
,3,What causes symptoms associated with sickle-cell disease?,"What are the smallest class of elements, containing just six members: boron (b",pleiotropic effects,genetic drift,spontaneous mutation,transgene effects,"['tellurium (Te)', 'silicon (Si)', 'antimony (Sb)']","Metalloids are the smallest class of elements, containing just six members: boron (B), silicon (Si), germanium (Ge), arsenic (As), antimony (Sb), and tellurium (Te). Metalloids have some properties of metals (elements that can conduct electricity) and some properties of nonmetals (elements that cannot conduct electricity). For example, most metalloids can conduct electricity, but not as well as metals. Metalloids also tend to be shiny like metals, but brittle like nonmetals. Chemically, metalloids may behave like metals or nonmetals, depending on their number of valence electrons. You can learn more about specific metalloids by clicking on the element symbols in the periodic table at this URL: http://www. chemicool. com/ .",,,,,,,,,,,,
,4,What is the purpose of a bird using flashy displays?,Birds often use flashy displays to what?,to attract mates,to protect their territory,to dissuade predators,to signal feeding,"['to play games', 'to play games', 'to play games']",Birds often use flashy displays to attract mates.,,,,,,,,,,,,
,5,What happens to water vapor as it rises?,What happens to water vapor as it rises from earth’s surface into the atmosphere?,it cools,it warms,it vibrates,it disperses,"['it condenses', 'it falls', 'it forms clouds']","The image below shows the role of the atmosphere in the water cycle ( Figure below ). Water vapor rises from Earth’s surface into the atmosphere. As it rises, it cools. The water vapor may then condense into water droplets and form clouds. If enough water droplets collect in clouds, they may come together to form droplets. The droplets will fall as rain. This how freshwater gets from the atmosphere back to Earth's surface.",,,,,,,,,,,,
,6,What is the conversion of a solid to a gas called?,What is the conversion of a solid (relatively high density) to a gas,sublimation,speciation,amplification,education,"['dilution', 'condensation', 'dilution']","(a) Sublimation is the conversion of a solid (relatively high density) to a gas (much lesser density). This process yields a much greater dispersal of matter, since the molecules will occupy a much greater volume after the solid-to-gas transition. (b) Condensation is the conversion of a gas (relatively low density) to a liquid (much greater density). This process yields a much lesser dispersal of matter, since the molecules will occupy a much lesser volume after the solid-to-gas transition. (c) The process in question is dilution. The food dye molecules initially occupy a much smaller volume (the drop of dye solution) than they occupy once the process is complete (in the full glass of water). The process therefore entails a greater dispersal of matter. The process may also yield a more uniform dispersal of matter, since the initial state of the system involves two regions of different dye concentrations (high in the drop, zero in the water), and the final state of the system contains a single dye concentration throughout.",,,,,,,,,,,,
,7,What creates new seafloor in the rift valleys?,What creates new seafloor in the rift valleys?,seafloor spreading,sedimentation,crust spreading,continental drift,"['volcanoes', 'islands', 'hotspots']","Volcanoes erupt at mid-ocean ridges, such as the Mid-Atlantic ridge. Seafloor spreading creates new seafloor in the rift valleys. This type of volcanism makes all of the ocean floor! Where a hotspot is located along the ridge, such as at Iceland, volcanoes grow high enough to create islands ( Figure below ).",,,,,,,,,,,,
,8,Where do mushrooms get their energy?,Mushrooms gain their energy from what?,decomposing dead organisms,killing organisms,accumulating dead organisms,producing dead organisms,"['plants', 'living organisms', 'living organisms']",Mushrooms gain their energy from decomposing dead organisms. Explain why a mushroom is not a plant.,,,,,,,,,,,,
,9,What allows some things to enter the cell while keeping other things out?,What is the window screen like?,cell membrane,cell substrate,cell center,cell vacuum,"['raindrop', 'airmolecule', 'fly']","This window screen has a fly on it. In a way, the window screen is like a cell membrane. It lets some things pass through while keeping other things out. Air molecules and raindrops can pass through the screen, but larger objects like the fly cannot. In the first lesson of this chapter, you'll learn about different ways that substances can pass through the cell membrane. You'll find out how the cell membrane lets some substances pass through while keeping other substances out.",,,,,,,,,,,,
,10,What is telomere shortening associated with?,What is the term for telomere shortening associated with?,aging,sleeping,reducing,changing,"['cell division', 'cell division', 'cell division']","Telomerase is not active in adult somatic cells. Adult somatic cells that undergo cell division continue to have their telomeres shortened. This essentially means that telomere shortening is associated with aging. In 2010, scientists found [1] that telomerase can reverse some age-related conditions in mice, and this may have potential in regenerative medicine. Mariella Jaskelioff, et al. , “Telomerase reactivation reverses tissue degeneration in aged telomerase-deficient mice,” Nature, 469 (2011):102–7.",,,,,,,,,,,,
,11,"Which  organs control the amount of water, ions, and other substances in the blood by excreting more or less of them in urine?",What organs filter all the blood in the body many times each day and produce a total of,kidneys,lungs,tongue,ears,"['heart', 'liver', 'lungs']","The kidneys play many vital roles in homeostasis. They filter all the blood in the body many times each day and produce a total of about 1.5 liters of urine. The kidneys control the amount of water, ions, and other substances in the blood by excreting more or less of them in urine. The kidneys also secrete hormones that help maintain homeostasis. Erythropoietin, for example, is a kidney hormone that stimulates bone marrow to produce red blood cells when more are needed. The kidneys themselves are also regulated by hormones. For example, antidiuretic hormone from the hypothalamus stimulates the kidneys to produce more concentrated urine when the body is low on water.",,,,,,,,,,,,
,12,A ramp is a type of simple machine called what?,What type of machine is a ramp?,inclined plane,extension plane,allow plane,rough plane,"['incline plane', 'sloped plane', 'inclined machine']","Look at the ramp in the Figure below . A ramp is a type of simple machine called an inclined plane. It can be used to raise an object off the ground. The input distance is the length of the sloped surface of the ramp. This is the distance over which the input force is applied. The output distance is the height of the ramp, or the vertical distance the object is raised. For this ramp, the input distance is 6 m and the output distance is 2 meters. Therefore, the ideal mechanical advantage of this ramp is:.",,,,,,,,,,,,
,13,What are the small molecules or proteins produced by bacteria that regulate gene expression?,What are small molecules or proteins produced by bacteria that regulate gene expression?,autoinducers,fluxes,protazoas,sporozoans,"['autoinducers', 'autoinducers', 'autoinducers']",Figure 9.17 Autoinducers are small molecules or proteins produced by bacteria that regulate gene expression.,,,,,,,,,,,,
,14,What is the term for the preserved remains or traces of organisms that lived in the past?,What are the preserved remains or traces of organisms that lived in the past?,fossils,corals,bones,detritis,"['shells', 'bones', 'teeth']","Fossils are the preserved remains or traces of organisms that lived in the past. The soft parts of organisms almost always decompose quickly after death. On occasion, the hard parts—mainly bones, teeth, or shells—remain long enough to mineralize and form fossils. An example of a complete fossil skeleton is shown in Figure below . The fossil record is the record of life that unfolded over four billion years and pieced back together through the analysis of fossils.",,,,,,,,,,,,
,15,What do we call a simple machine that consists of a rope and grooved wheel?,What is a simple machine that consists of a rope and grooved wheel?,pulley,axle,lever,pedal,"['pulley and grooved wheel', 'pulley and grooved wheel', 'pulley and grooved wheel']",A pulley is a simple machine that consists of a rope and grooved wheel. Single pulleys may be fixed or moveable. Single and moveable pulleys may be combined in a compound pulley. The ideal mechanical advantage of a pulley or compound pulley is always equal to or greater than 1. Fixed pulleys and some compound pulleys also change the direction of the input force.,,,,,,,,,,,,
,16,What are the specialized cells that sponges have?,Sponges have specialized cells called what?,collar cells,tune cells,magnet cells,blood cells,"['sponges', 'sponges', 'sponges']",Sponges have specialized cells called collar cells. Describe how collar cells are specialized for the functions they serve.,,,,,,,,,,,,
,17,What process takes place when plants release water vapor through pores in their leaves called stomata?,What takes place when plants release water vapor through pores in their leaves called stomata,transpiration,evaporation,expiration,propagation,"['transpiration', 'transpiration', 'transpiration']",Transpiration takes place when plants release water vapor through pores in their leaves called stomata.,,,,,,,,,,,,
,18,"Foodborne illness, food allergies, or a food intolerance cause symptoms in what system?",What system works well without causing any problems?,digestive,respiratory,circulatory,skeletal,"['nervous', 'nervous', 'nervous']","Most of the time, you probably aren’t aware of your digestive system. It works well without causing any problems. But most people have problems with their digestive system at least once in a while. Did you ever eat something that didn’t “agree” with you? Maybe you had a stomachache or felt sick to your stomach? Maybe you had diarrhea? These could be symptoms of foodborne illness, food allergies, or a food intolerance.",,,,,,,,,,,,
,19,"Inside female cones, female spores develop into female what?","Inside male cones, male spores develop into male what?",gametophytes,gymnosperms,filaments,tubules,"['spores', 'pollen', 'spores']","Cones form on a mature sporophyte plant. Inside male cones, male spores develop into male gametophytes. Each male gametophyte consists of several cells enclosed within a grain of pollen . Inside female cones, female spores develop into female gametophytes. Each female gametophyte produces an egg inside an ovule.",,,,,,,,,,,,
,20,The lens and other parts of the eye work together to focus a real image on what eye structure?,The lens and other structures of the eye work together to focus a real image on what?,retina,iris,pupil,cornea,"['optic nerve', 'optic nerve', 'brain']","As just described, the eyes collect and focus visible light. The lens and other structures of the eye work together to focus a real image on the retina. The image is upside-down and reduced in size, as you can see in Figure below . The image reaches the brain as electrical signals that travel through the optic nerve. The brain interprets the signals as shape, color, and brightness. It also interprets the image as though it were right-side up. The brain does this automatically, so what we see is always right-side up. The brain also “tells” us what we are seeing.",,,,,,,,,,,,
,21,What do you call the basic units of the structure and function of living things?,What are the basic units of the structure and function of living things?,cells,molecules,enzymes,proteins,"['organisms', 'organisms', 'organisms']","If you look at living matter with a microscope—even a simple light microscope—you will see that it consists of cells. Cells are the basic units of the structure and function of living things. They are the smallest units that can carry out the processes of life. All organisms are made up of one or more cells, and all cells have many of the same structures and carry out the same basic life processes. Knowing the structures of cells and the processes they carry out is necessary to understanding life itself.",,,,,,,,,,,,
,22,"""incident"" and ""reflected"" are two types of what?",Waves of light are represented by arrows called what?,rays,cells,mirrors,collisions,"['incident rays', 'reflected rays', 'incident rays']","In the Figure below , you can see how both types of reflection occur. Waves of light are represented by arrows called rays. Rays that strike the surface are referred to as incident rays, and rays that reflect off the surface are known as reflected rays. In regular reflection, all the rays are reflected in the same direction. This explains why regular reflection forms a clear image. In diffuse reflection, the rays are reflected in many different directions. This is why diffuse reflection forms, at best, a blurry image. You can see animations of both types of reflection at this URL: http://toolboxes. flexiblelearning. net. au/demosites/series5/508/Laboratory/StudyNotes/snReflectionMirrors. htm.",,,,,,,,,,,,
,23,What is the name of the molecule which has one carbon and four hydrogen atoms?,What is the molecule with one carbon and four hydrogen atoms?,methane,carbohydrate,sulfur,carbon monoxide,"['carbon', 'hydrogen', 'oxygen']",Hydrocarbons are made of carbon and hydrogen atoms. This molecule with one carbon and four hydrogen atoms is methane.,,,,,,,,,,,,
,24,What is required to move or change matter from one state to another?,What provides the ability to move or change matter from one state to another?,energy,food,gravity,evolution,"['water', 'food', 'air']","Energy provides the ability to move or change matter from one state to another (for example, from solid to liquid). Every living thing needs energy to live and grow. Your body gets its energy from food, but that is only a small part of the energy you use every day. Cooking your food takes energy, and so does keeping it cold in the refrigerator or the freezer. The same is true for heating or cooling your home. Whether you are turning on a light in the kitchen or riding in a car to school, you are using energy. Billions of people all around the world use energy, so there is a huge demand for resources to provide all of this energy. Why do we need so much energy? The main reason is that almost everything that happens on Earth involves energy.",,,,,,,,,,,,
,25,"When a stream or river slows down, it starts dropping its what?","When a stream or river slows down, it starts dropping what?",sediments,fragments,organisms,pollutants,"['rocks', 'rocks', 'rocks']","When a stream or river slows down, it starts dropping its sediments. Larger sediments are dropped in steep areas, but smaller sediments can still be carried. Smaller sediments are dropped as the slope becomes less steep.",,,,,,,,,,,,
,26,"Like the platypus, the echnida is a what?",What is the name of the species that inhabits Australia and New Guinea?,monotreme,prosauropod,Gives Live birth,dugongs,"['platypus', 'echnidna', 'platypus']","Echidna. Like the platypus, the echnida is a monotreme. The only living monotreme species inhabit Australia and New Guinea.",,,,,,,,,,,,
,27,Does atmospheric pressure increase or decrease as the altitude increases?,What happens to atmospheric pressure as the altitude increases?,decreases,increase,stays the same,depends on other factors,"['increases', 'increases', 'increases']",Atmospheric pressure decreases as the altitude increases.,,,,,,,,,,,,
,28,"What group was long considered part of the plant kingdom because of obvious similarities; both are immobile, have cell walls, and grow in soil?","What are immobile, have cell walls, and grow in soil?",fungi,mosses,coral,bacteria,"['lichens', 'plants', 'lichens']","For a long time, scientists considered fungi to be members of the plant kingdom because they have obvious similarities with plants. Both fungi and plants are immobile, have cell walls, and grow in soil. Some fungi, such as lichens, even look like plants (see Figure below ).",,,,,,,,,,,,
,29,What are people with osteoporosis at increased risk of?,What is the most common cause of a fracture in the skeletal system?,bone fractures,epilepsy,senility,growth spurt,"['lichen fractures', 'fungi fractures', 'lichen fractures']","For a long time, scientists considered fungi to be members of the plant kingdom because they have obvious similarities with plants. Both fungi and plants are immobile, have cell walls, and grow in soil. Some fungi, such as lichens , even look like plants (see Figure below ).",,,,,,,,,,,,
,30, ,What is the most abundant metal?,aluminum,calcium,copper,magnetite,"['calcium', 'magnesium', 'iron']","Metals represent approximately 25% of the elemental makeup of the Earth's crust. The bulk of these metals, primarily aluminum, iron, calcium, sodium, potassium, and magnesium, are typically found in combined form. The most abundant metal is aluminum, which occurs almost exclusively as the ionic mineral bauxite. The other most common metals, including iron, sodium, potassium, magnesium, and calcium, are also found primarily as the cationic portion of an ionic compound. Very few metals actually occur naturally as pure substances. The ones that do are often referred to as precious or semi-precious metals.",,,,,,,,,,,,
,31,What is the name of the first stage of photosynthesis?,What is the first stage of photosynthesis called?,light reactions,consumption,absorption,contamination,"['chemical energy', 'chemical energy', 'light absorbed']","The first stage of photosynthesis is called the light reactions. During this stage, light is absorbed and transformed to chemical energy in the bonds of NADPH and ATP. You can follow the process in the Figure below as you read about it below.",,,,,,,,,,,,
